{
  "labels": {
    "run": "Meta",
    "flow": "Flow",
    "constraints": "Constraints",
    "clocks": "Clocks",
    "synth": "Synthesis",
    "runtime": "Runtime",
    "design": "Design",
    "timing": "Timing",
    "power": "Power",
    "floorplan": "Floorplan",
    "globalplace": "Global Placement",
    "placeopt": "Placement Optimization",
    "cts": "Clock Tree Synthesis",
    "clock": "Clock",
    "globalroute": "Global Routing",
    "detailedplace": "Detailed Placement",
    "finish": "Final Design",
    "flow__design": "Design Name",
    "flow__platform": "Technology Platform",
    "flow__generate_date": "Generation Date",
    "flow__openroad_version": "OpenROAD Version",
    "flow__variant": "Flow Variant",
    "clocks__count": "Clock Count",
    "clocks__details": "Clock Details",
    "runtime__total": "Total Runtime",
    "design__die__area": "Die Area",
    "design__core__area": "Core Area",
    "design__instance__area": "Total Instance Area",
    "design__instance__count": "Total Instance Count",
    "timing__setup__ws": "Setup Worst Slack",
    "timing__setup__tns": "Setup Total Negative Slack",
    "timing__hold__ws": "Hold Worst Slack",
    "timing__hold__tns": "Hold Total Negative Slack",
    "timing__fmax": "Maximum Operating Frequency",
    "power__total": "Total Power",
    "power__internal__total": "Total Internal Power",
    "power__switching__total": "Total Switching Power",
    "power__leakage__total": "Total Leakage Power",
    "design__instance__utilization": "Overall Instance Utilization",
    "clock__skew__setup": "Setup Clock Skew",
    "clock__skew__hold": "Hold Clock Skew"
  },
  "units": {
    "flow__design": "",
    "flow__platform": "",
    "flow__generate_date": "",
    "flow__openroad_version": "",
    "flow__variant": "",
    "clocks__count": "",
    "clocks__details": "",
    "runtime__total": "s",
    "design__die__area": "um^2",
    "design__core__area": "um^2",
    "design__instance__area": "um^2",
    "design__instance__count": "",
    "timing__setup__ws": "ps",
    "timing__setup__tns": "ps",
    "timing__hold__ws": "ps",
    "timing__hold__tns": "ps",
    "timing__fmax": "Hz",
    "power__total": "W",
    "power__internal__total": "W",
    "power__switching__total": "W",
    "power__leakage__total": "W",
    "design__instance__utilization": "ratio",
    "clock__skew__setup": "ps",
    "clock__skew__hold": "ps"
  },
  "date": "run/flow/flow__generate_date",
  "commit": "metadata/current_commit",
  "summary": [
    "run/flow/flow__generate_date",
    "run/flow/flow__openroad_version",
    "run/flow/flow__design",
    "run/flow/flow__platform",
    "run/flow/flow__variant",
    "constraints/clocks/clocks__count",
    "constraints/clocks/clocks__details"
  ],
  "unplottable": ["run", "constraints"]
}
